title,ratings_count,rating_score,region,source,clarity_specifies_location,clarity_specifies_core_activity,clarity_indicates_activity_format,clarity_specifies_key_transport,clarity_indicates_day_trip_origin,value_highlights_access_benefit,value_specifies_guidance,value_specifies_ticket_inclusion,value_mentions_food_drink,value_indicates_target_audience,experience_specifies_group_size,experience_highlights_time_benefit,experience_specifies_duration,experience_uses_hook_keywords,experience_highlights_unique_access,quality_free_of_errors,quality_uses_appropriate_caps,quality_free_of_contact_info,quality_free_of_price_info,quality_concise_and_scannable,processed
Nashville: Downtown Helicopter Tour,185,4.854054,usa,getyourguide,True,True,True,False,False,False,False,False,False,False,False,False,False,False,False,True,True,True,True,True,True
Monterey Bay: Sunset Catamaran Sailing Cruise,20,4.8,usa,getyourguide,True,True,True,False,False,False,False,False,False,False,False,True,False,False,False,True,True,True,True,True,True
From Maalaea: Whale Watching Catamaran Cruise with Drinks,19,4.6842103,usa,getyourguide,True,True,True,True,True,False,False,False,True,False,False,False,False,False,False,True,True,True,True,True,True
San Francisco: Golden Gate Bridge and Sausalito Cycling Tour,464,4.6551723,usa,getyourguide,True,True,True,True,False,False,False,False,False,False,False,False,False,False,False,True,True,True,True,True,True
NYC: Sunset Sail Aboard Schooner Adirondack,215,4.8930235,usa,getyourguide,True,True,True,False,False,False,False,False,False,False,False,True,False,False,False,True,True,True,True,True,True
Daytona Beach: Small Group Champagne Sunset Cruise,8,5.0,usa,getyourguide,True,True,True,False,False,False,False,False,False,False,True,True,False,False,False,True,True,True,True,True,True
Key West: Jimmy Buffet Walking Tour with Key Lime Pie,19,4.5263157,usa,getyourguide,True,True,True,False,False,False,False,False,True,False,False,False,False,False,False,True,True,True,True,True,True
DC: Lincoln Assassination Walking Tour with Ford's Theatre,32,4.625,usa,getyourguide,True,True,True,False,False,False,False,False,False,False,False,False,False,False,False,True,True,True,True,True,True
NYC: Central Park Celebrity Homes & Film Spots Pedicab Tour,573,4.9197206,usa,getyourguide,True,True,True,True,False,False,False,False,False,False,False,False,False,True,False,True,True,True,True,True,True
Monument Valley: 3-Hour Sunrise Tour,77,4.844156,usa,getyourguide,True,True,True,False,False,False,False,False,False,False,False,True,True,False,False,True,True,True,True,True,True
"Everglades: Mangrove, Grassland Airboat Tours, & Boardwalk",23,4.304348,usa,getyourguide,True,True,True,False,False,False,False,False,False,False,False,False,False,False,False,True,True,True,True,True,True
City Cruises Chicago: Lake Michigan Lunch or Dinner Cruise,236,4.3050847,usa,getyourguide,True,True,True,False,False,False,False,False,True,False,False,False,False,False,False,True,True,True,True,True,True
Joshua Tree: Soundbath Under The Stars,4,5.0,usa,getyourguide,True,True,False,False,False,False,False,False,False,False,False,True,False,True,False,True,True,True,True,True,True
Chicago: Gangsters and Food Tasting Walking Tour,135,4.6222224,usa,getyourguide,True,True,True,False,False,False,False,False,True,False,False,False,False,False,False,True,True,True,True,True,True
From Cottonwood: Guided Kayaking Tour on the Verde River,46,4.9565215,usa,getyourguide,True,True,True,False,True,False,True,False,False,False,False,False,False,False,False,False,False,False,False,False,True
Fort Myers: Guided Standup Paddleboarding or Kayaking Tour,32,4.5,usa,getyourguide,True,True,True,False,False,False,True,False,False,False,False,False,False,False,False,True,True,True,True,True,True
2 Hour Group Surf Lesson in Miami Beach,45,4.733333,usa,getyourguide,True,True,True,False,False,False,False,False,False,False,True,False,True,False,False,True,True,True,True,True,True
Dana Point Dolphin & Whale Watching With Underwater Viewing,27,4.814815,usa,getyourguide,False,True,True,False,False,False,False,False,False,False,False,False,False,False,False,True,True,True,True,True,True
Kalapaki Beach: Surfing Lesson with Kauai Beach Boys,10,5.0,usa,getyourguide,True,True,True,False,False,False,False,False,False,False,False,False,False,False,False,True,True,True,True,True,True
Las Vegas: Sightseeing Night Tour by Open-top Bus,1839,4.2398043,usa,getyourguide,True,True,True,True,False,False,False,False,False,False,False,True,False,False,False,True,True,True,True,True,True
San Diego: La Jolla Cove Guided Snorkeling Tour,17,4.882353,usa,getyourguide,True,True,True,False,False,False,True,False,False,False,False,False,False,False,False,True,True,True,True,True,True
3-Hour Secret Food Tour,82,4.585366,usa,getyourguide,False,True,True,False,False,False,False,False,False,False,False,False,True,True,False,True,True,True,True,True,True
Miami Beach: City Highlights Guided Bike or eBike Tour,22,4.7272725,usa,getyourguide,True,True,True,True,False,False,True,False,False,False,False,False,False,True,False,True,True,True,True,True,True
From Ma'alaea: Afternoon Whale Watch Tour Aboard the Malolo,118,4.5508475,usa,getyourguide,False,True,True,False,True,False,False,False,False,False,False,True,False,False,False,True,True,True,True,True,True
Nashville: The Gulch Walking & Tasting Food Tour,32,4.96875,usa,getyourguide,True,True,True,False,False,False,False,False,True,False,False,False,False,False,False,True,True,True,True,True,True
Miami: Jet Ski & Boat Ride on the Bay,233,4.021459,usa,getyourguide,True,True,False,True,False,False,False,False,False,False,False,False,False,False,False,True,True,True,True,True,True
Nashville's Speakeasy Secrets: True Crime Tasting Pub Crawl,40,4.65,usa,getyourguide,True,True,True,False,False,False,False,False,True,False,False,False,False,True,False,True,True,True,True,True,True
Oahu: Tandem Jet Ski Adventure on Maunalua Bay,47,4.191489,usa,getyourguide,True,True,False,False,False,False,False,False,False,False,False,False,False,True,False,True,True,True,True,True,True
Key West: Guided Bicycle Tour with Key Lime Pie,138,4.8768115,usa,getyourguide,True,True,True,True,False,False,True,False,True,False,False,False,False,False,False,True,True,True,True,True,True
Nashville: Downtown Helicopter Experience,40,5.0,usa,getyourguide,True,True,False,False,False,False,False,False,False,False,False,False,False,False,False,True,True,True,True,True,True
Washington DC: Monuments by Night Bike Tour,222,4.6126127,usa,getyourguide,True,True,True,True,False,False,False,False,False,False,False,True,False,False,False,True,True,True,True,True,True
Savannah: Local Favorites Walking Food Tour,139,4.726619,usa,getyourguide,True,True,True,False,False,False,False,False,True,False,False,False,False,False,False,True,True,True,True,True,True
Washington DC: Capitol Hill Walking Tour,58,3.5689654,usa,getyourguide,True,True,True,False,False,False,False,False,False,False,False,False,False,False,False,True,True,True,True,True,True
Hilton Head Island: 1.5-Hour Guided Small-Group Kayak Tour,60,4.616667,usa,getyourguide,True,True,True,True,False,False,True,False,False,False,True,False,True,False,False,True,True,True,True,True,True
Daytona Beach: Coastal Discovery Cruise,16,4.75,usa,getyourguide,True,True,True,False,False,False,False,False,False,False,False,False,False,False,False,True,True,True,True,True,True
Manhattan: Statue and Skyline Cruise Aboard a Luxury Yacht,425,4.8235292,usa,getyourguide,True,True,True,True,False,False,False,False,False,False,False,False,False,True,False,True,True,True,True,True,True
San Diego: Sunset and Day Sailing Excursion with Drinks,37,4.972973,usa,getyourguide,True,True,True,False,False,False,False,False,True,False,False,True,False,False,False,True,True,True,True,True,True
New Orleans: The Premier Food Tour — Your Must-Do Activity,13,4.769231,usa,getyourguide,True,True,True,False,False,False,False,False,False,False,False,False,False,True,False,True,True,True,True,True,True
From Skagway: Skagway City & White Pass Summit Guided Tour,35,4.714286,usa,getyourguide,True,True,True,False,True,False,True,False,False,False,False,False,False,False,False,False,False,False,False,False,True
Page: Lake Powell Scenic Dam Cruise,20,3.75,usa,getyourguide,True,True,True,False,False,False,False,False,False,False,False,False,False,False,False,True,True,True,True,True,True
Orlando: Small Group Rock Springs Run Kayak Tour,25,4.92,usa,getyourguide,True,True,True,False,False,False,False,False,False,False,True,False,False,False,False,True,True,True,True,True,True
Florida Keys: Dockside Dolphin Experience,31,4.677419,usa,getyourguide,True,True,False,False,False,False,False,False,False,False,False,False,False,False,False,True,True,True,True,True,True
From New Orleans: Destrehan Plantation Haunted Night Tour,22,4.3636365,usa,getyourguide,True,True,True,False,True,False,False,False,False,False,False,True,False,False,False,True,True,True,True,True,True
Ft. Lauderdale: Party Boat Tour to the Sandbar with Tunes,26,4.4615383,usa,getyourguide,True,True,True,True,False,False,False,False,False,False,False,False,False,True,False,True,True,True,True,True,True
Boston: 2.5-Hour City View Bike Tour,267,4.820225,usa,getyourguide,True,True,True,True,False,False,False,False,False,False,False,False,True,False,False,True,True,True,True,True,True
Key West: Afternoon Reef Snorkel Tour with Open Bar,256,4.2070312,usa,getyourguide,True,True,True,False,False,False,False,False,True,False,False,True,False,False,False,True,True,True,True,True,True
"Washington, DC: National Mall and Memorials Moonlight Tour",27,4.6666665,usa,getyourguide,True,True,True,False,False,False,False,False,False,False,False,True,False,False,False,True,True,True,True,True,True
Moab: 1-Hour Colorado River Speed Boat Tour,60,4.883333,usa,getyourguide,True,True,True,True,False,False,False,False,False,False,False,False,True,False,False,True,True,True,True,True,True
Bryson City: Nantahala River Guided Whitewater Rafting Trip,13,4.4615383,usa,getyourguide,True,True,True,False,False,False,True,False,False,False,False,False,False,False,False,True,True,True,True,True,True
Miami: Parasailing Experience in Biscayne Bay,311,4.504823,usa,getyourguide,True,True,False,False,False,False,False,False,False,False,False,False,False,False,False,True,True,True,True,True,True
Savannah: Monday Gospel Dinner Cruise,77,4.8831167,usa,getyourguide,True,True,True,False,False,False,False,False,True,False,False,False,False,False,False,True,True,True,True,True,True
Miami: ATV Nighttime Glow In The Dark Off-road Adventure,4,4.25,usa,getyourguide,True,True,False,False,False,False,False,False,False,False,False,True,False,True,False,True,True,True,True,True,True
Oahu: Waikiki Sunset and Cocktail Cruise,195,4.610256,usa,getyourguide,True,True,True,False,False,False,False,False,True,False,False,True,False,False,False,True,True,True,True,True,True
Phoenix: Self-Guided Kayaking Trip to Foxtail,72,4.7083335,usa,getyourguide,True,True,True,True,False,False,False,False,False,False,False,False,False,False,False,True,True,True,True,True,True
New York City: Food Walking Tour of Chinatown & Little Italy,175,4.8228574,usa,getyourguide,True,True,True,False,False,False,False,False,True,False,False,False,False,False,False,True,True,True,True,True,True
Orlando: Kayaking Tour with Manatee Encounter,153,4.7058825,usa,getyourguide,True,True,True,False,False,False,False,False,False,False,False,False,False,False,False,True,True,True,True,True,True
Nashville: Street Art & Instagram Golf Cart Tour,61,4.803279,usa,getyourguide,True,True,True,True,False,False,False,False,False,False,False,False,False,False,False,True,True,True,True,True,True
Savannah: Walktails and Bar Bites,21,4.904762,usa,getyourguide,True,True,True,False,False,False,False,False,True,False,False,False,False,False,False,True,True,True,True,True,True
Key West: Ultimate Parasailing Experience,23,4.7826085,usa,getyourguide,True,True,False,False,False,False,False,False,False,False,False,False,False,True,False,True,True,True,True,True,True
San Diego: Haunted Ghost Tour by Bus,19,4.736842,usa,getyourguide,True,True,True,True,False,False,False,False,False,False,False,False,False,False,False,True,True,True,True,True,True
Oahu: BYOB or Cash Bar Waikiki Sunset Cruise,75,4.68,usa,getyourguide,True,True,True,False,False,False,False,False,False,False,False,True,False,False,False,True,True,True,True,True,True
Gettysburg: Advanced Paranormal Investigation Tour,46,4.521739,usa,getyourguide,True,True,True,False,False,False,False,False,False,False,False,False,False,True,False,True,True,True,True,True,True
Goodland: Best of Marco Island Tour,8,5.0,usa,getyourguide,True,True,True,False,False,False,False,False,False,False,False,False,False,True,False,True,True,True,True,True,True
San Francisco: Golden Gate Bridge to Sausalito Bike Tour,81,4.6790123,usa,getyourguide,True,True,True,True,False,False,False,False,False,False,False,False,False,False,False,True,True,True,True,True,True
Waco: Fixer Upper Highlights and City Tour by Van,0,5.0,usa,getyourguide,True,True,True,True,False,False,False,False,False,False,False,False,False,True,False,True,True,True,True,True,True
Miami: Redland Hidden Trails Moonlight ATV Adventure,51,4.647059,usa,getyourguide,True,True,True,True,False,False,False,False,False,False,False,True,False,True,False,True,True,True,True,True,True
Jupiter: Clear Kayak Tour,0,5.0,usa,getyourguide,True,True,True,False,False,False,False,False,False,False,False,False,False,False,False,True,True,True,True,True,True
From New Jersey: New York City Buffet Lunch or Dinner Cruise,70,3.7857144,usa,getyourguide,True,False,True,False,True,False,False,False,True,False,False,False,False,False,False,True,True,True,True,True,True
Savannah: Guided Paranormal Ghost Hunting Investigation,13,4.5384617,usa,getyourguide,True,True,True,False,False,False,True,False,False,False,False,False,False,True,False,True,True,True,True,True,True
"2-Hour, 30-Minute Tour de Wilmington E-Bike Tour",10,5.0,usa,getyourguide,True,True,True,True,False,False,False,False,False,False,False,False,True,False,False,True,True,True,True,True,True
National Museum of Natural History Guided Tour,28,4.857143,usa,getyourguide,False,True,True,False,False,False,True,False,False,False,False,False,False,False,False,True,True,True,True,True,True
Boston: North End Pizza Walking Tour with 3 Slices & Cannoli,127,4.6062994,usa,getyourguide,True,True,True,False,False,False,False,False,True,False,False,False,False,False,False,True,True,True,True,True,True
The Birthplace of Hip Hop Bus Tour,5,5.0,usa,getyourguide,False,True,True,False,False,False,False,False,False,False,False,False,False,False,False,True,True,True,True,True,True
San Juan: Old San Juan Walking Tour,46,4.7391305,usa,getyourguide,True,True,True,False,False,False,False,False,False,False,False,False,False,False,False,True,True,True,True,True,True
Cincinnati: Dixieland Jazz Brunch Cruise,42,4.5,usa,getyourguide,True,True,True,False,False,False,False,False,True,False,False,False,False,False,False,True,True,True,True,True,True
NYC: Brooklyn Graffiti Workshop with Local Artist,475,4.797895,usa,getyourguide,True,True,True,False,False,False,True,False,False,False,False,False,False,False,False,True,True,True,True,True,True
"Niagara Falls, NY: Winter Niagara Falls with Cave/Gorge Tour",9,5.0,usa,getyourguide,True,True,True,False,False,False,False,False,False,False,False,False,False,False,False,True,True,True,True,True,True
Robinson Preserve Mangrove Tour,3,5.0,usa,getyourguide,True,True,True,False,False,False,False,False,False,False,False,False,False,False,False,True,True,True,True,True,True
Washington DC: Potomac Cruise and Georgetown Walking Tour,68,4.4852943,usa,getyourguide,True,True,True,False,False,False,False,False,False,False,False,False,False,False,False,True,True,True,True,True,True
NYC: Sightseeing Night Tour by Open-Top Bus with Live Guide,166,4.1445785,usa,getyourguide,True,True,True,True,False,False,True,False,False,False,False,True,False,False,False,True,True,True,True,True,True
Salt Lake City: Guided City Tour,36,4.8055553,usa,getyourguide,True,True,True,False,False,False,True,False,False,False,False,False,False,False,False,True,True,True,True,True,True
Ketchikan: Alaska Rainforest Sanctuary and Totem Park Walk,14,4.285714,usa,getyourguide,True,True,True,False,False,False,False,False,False,False,False,False,False,False,False,True,True,True,True,True,True
Miami Marlins Baseball Game Ticket at LoanDepot Park,68,4.5147057,usa,getyourguide,True,True,False,False,False,False,False,True,False,False,False,False,False,False,False,True,True,True,True,True,True
Oahu: Premium Waikiki Sunset Party Cruise with Live DJ,128,4.8046875,usa,getyourguide,True,True,True,False,False,False,False,False,False,False,False,True,False,True,False,True,True,True,True,True,True
Savannah: Dolphin Spotting Eco Tour with Experienced Captain,8,5.0,usa,getyourguide,True,True,True,False,False,False,True,False,False,False,False,False,False,False,False,True,True,True,True,True,True
Monterey: Cannery Row Kayak Tour,13,4.923077,usa,getyourguide,True,True,True,True,False,False,False,False,False,False,False,False,False,False,False,True,True,True,True,True,True
Fort Lauderdale: Evening Boat Cruise with Downtown Views,36,4.6944447,usa,getyourguide,True,True,True,True,False,False,False,False,False,False,False,True,False,False,False,True,True,True,True,True,True
Miami: Off-Road ATV Guided Tour,109,4.5137615,usa,getyourguide,True,True,True,True,False,False,True,False,False,False,False,False,False,False,False,True,True,True,True,True,True
Orlando: Small Group Manatee Discovery Kayak Tour,114,4.9210525,usa,getyourguide,True,True,True,True,False,False,False,False,False,False,True,False,False,False,False,True,True,True,True,True,True
Charleston: Custom Perfume or Cologne Making Experience,17,4.9411764,usa,getyourguide,True,True,True,False,False,False,False,False,False,False,False,False,False,False,False,True,True,True,True,True,True
Boston's North End: Secret Food Tour,174,4.724138,usa,getyourguide,True,True,True,False,False,False,False,False,False,False,False,False,False,True,False,True,True,True,True,True,True
High Roller Entry Ticket with In-Cabin Open Bar,1109,4.5707846,usa,getyourguide,False,True,False,False,False,False,False,True,True,False,False,False,False,False,False,True,True,True,True,True,True
Nashville: Pontoon Party Cruise with a Captain,97,4.8247423,usa,getyourguide,True,True,True,True,False,False,False,False,False,False,False,False,False,False,False,True,True,True,True,True,True
Azores: Swim with Dolphins Atlantic Experience,22,4.9545455,usa,getyourguide,True,True,False,False,False,False,False,False,False,False,False,False,False,False,False,True,True,True,True,True,True
San Francisco: Chinatown Culinary Walking Tour,227,4.7753305,usa,getyourguide,True,True,True,False,False,False,False,False,False,False,False,False,False,False,False,True,True,True,True,True,True
Washington DC: See the City Segway Tour,343,4.857143,usa,getyourguide,True,True,True,True,False,False,False,False,False,False,False,False,False,False,False,True,True,True,True,True,True
Orlando: Pirates Adventure Dinner Show with Drinks,429,4.149184,usa,getyourguide,True,True,False,False,False,False,False,False,True,False,False,False,False,False,False,True,True,True,True,True,True
Miami: Party Yacht Cruise with Open Bar and DJ,3,4.3333335,usa,getyourguide,True,True,True,False,False,False,False,False,True,False,False,False,False,False,False,True,True,True,True,True,True
Nashville: Exclusive Entry and Special Offers VIP Bar Crawl,15,4.3333335,usa,getyourguide,True,True,False,False,False,True,False,False,False,False,False,False,False,True,False,True,True,True,True,True,True
NYC: Hell's Kitchen on Broadway Entry Ticket,93,4.892473,usa,getyourguide,True,True,False,False,False,False,False,True,False,False,False,False,False,False,False,True,True,True,True,True,True
New Orleans: Urban Cultural and Historical City Tour,15,4.733333,usa,getyourguide,True,True,True,False,False,False,False,False,False,False,False,False,False,False,False,True,True,True,True,True,True
San Francisco: Golden Gate Bridge Guided Bike or eBike Tour,45,4.6444445,usa,getyourguide,True,True,True,True,False,False,True,False,False,False,False,False,False,False,False,True,True,True,True,True,True
Solvang: Wine and True Crime Tour with Drinks Included,5,4.8,usa,getyourguide,True,True,True,False,False,False,False,False,True,False,False,False,False,False,False,True,True,True,True,True,True
New Orleans: BYOB Tiki Boat Bayou Party and Wildlife Tour,20,4.65,usa,getyourguide,True,True,True,False,False,False,False,False,False,False,False,False,False,False,False,True,True,True,True,True,True
Downtown Boston Harbor Weekend Cruise with Brunch,60,4.733333,usa,getyourguide,True,True,True,False,False,False,False,False,True,False,False,False,False,False,False,True,True,True,True,True,True
Smithsonian National Museum of Natural History Guided Tour,146,3.9931507,usa,getyourguide,True,True,True,False,False,False,True,False,False,False,False,False,False,False,False,True,True,True,True,True,True
NYC: Gossip Girl Sites Bus Tour,411,4.523114,usa,getyourguide,True,True,True,False,False,False,False,False,False,False,False,False,False,False,False,True,True,True,True,True,True
DC: Monuments & National Mall Guided Tour by Vintage Cart,63,4.857143,usa,getyourguide,True,True,True,True,False,False,True,False,False,False,False,False,False,False,False,True,True,True,True,True,True
San Diego: San Diego Bay Sunset & Daytime Sailing Experience,164,4.97561,usa,getyourguide,True,True,False,False,False,False,False,False,False,False,False,True,False,False,False,True,True,True,True,True,True
Fort Myers Beach: Adults only BYOB Tiki Pub Sunset Cruise,15,4.866667,usa,getyourguide,True,True,True,False,False,False,False,False,False,True,False,True,False,False,False,True,True,True,True,True,True
Page: Antelope Canyon X Hiking Tour with Photo Tour Option,7,4.857143,usa,getyourguide,True,True,True,False,False,False,False,False,False,False,False,False,False,False,False,True,True,True,True,True,True
Captain's Choice: Dolphin Watch Sunset Sail,15,4.133333,usa,getyourguide,False,True,True,False,False,False,False,False,False,False,False,True,False,True,False,True,True,True,True,True,True
Charleston: Downtown Culinary Walking Tour,33,4.939394,usa,getyourguide,True,True,True,False,False,False,False,False,False,False,False,False,False,False,False,True,True,True,True,True,True
"Savannah: History, Culture, & Scenic Views E-Bike Tour",45,4.866667,usa,getyourguide,True,True,True,True,False,False,False,False,False,False,False,False,False,False,False,True,True,True,True,True,True
DC: National Archives & Museum of American History Tour,31,4.677419,usa,getyourguide,True,True,True,False,False,False,False,False,False,False,False,False,False,False,False,True,True,True,True,True,True
New Orleans: Creole Queen Weekend Morning Jazz Cruise,124,4.290323,usa,getyourguide,True,True,True,True,False,False,False,False,False,False,False,True,False,False,False,True,True,True,True,True,True
Downtown Bike Tour with Stylish Dutch Bikes!,19,4.8421054,usa,getyourguide,False,True,True,True,False,False,False,False,False,False,False,False,False,False,False,True,True,True,True,True,True
Kissimmee: Boggy Creek Sunset Airboat Tour,79,4.658228,usa,getyourguide,True,True,True,False,False,False,False,False,False,False,False,True,False,False,False,True,True,True,True,True,True
"Miami: Adventure Cruise with Jetski, Tubing, and Drinks",51,4.117647,usa,getyourguide,True,True,True,False,False,False,False,False,True,False,False,False,False,True,False,True,True,True,True,True,True
Orange Beach: Dolphin-Watching Sunset Cruise,15,4.733333,usa,getyourguide,True,True,True,False,False,False,False,False,False,False,False,True,False,False,False,True,True,True,True,True,True
Sarasota: Myakka State Park E-bike Safari Experience,9,4.888889,usa,getyourguide,True,True,False,True,False,False,False,False,False,False,False,False,False,True,False,True,True,True,True,True,True
Washington DC: National Gallery of Art - Guided Museum Tour,15,5.0,usa,getyourguide,True,True,True,False,False,False,True,False,False,False,False,False,False,False,False,True,True,True,True,True,True
"Miami Salsa Party: Lessons, Mojitos, Appetizers & Live Music",143,4.7202797,usa,getyourguide,True,True,True,False,False,False,False,False,True,False,False,False,False,False,False,True,True,True,True,True,True
NYC: English or German Central Park Bike Tour & eBike Option,50,4.46,usa,getyourguide,True,True,True,True,False,False,False,False,False,False,False,False,False,False,False,True,True,True,True,True,True
Nashville: Guided Foodie Walking Tour with Tastings,143,4.734266,usa,getyourguide,True,True,True,False,False,False,True,False,True,False,False,False,False,False,False,True,True,True,True,True,True
NYC: Extended Tour of the Metropolitan Museum of Art,337,4.6735907,usa,getyourguide,True,True,True,False,False,False,False,False,False,False,False,False,False,False,False,True,True,True,True,True,True
Seattle: 3-Hour City Tour by Bus,292,4.719178,usa,getyourguide,True,True,True,True,False,False,False,False,False,False,False,False,True,False,False,True,True,True,True,True,True
"New Orleans: History, Culture & Architecture Guided Tour",27,4.4444447,usa,getyourguide,True,True,True,False,False,False,True,False,False,False,False,False,False,False,False,True,True,True,True,True,True
Guided Central Park and NYC Horse Carriage Ride,13,4.6923075,usa,getyourguide,True,True,True,False,False,False,True,False,False,False,False,False,False,False,False,True,True,True,True,True,True
Oahu: Friday Night Fireworks Cocktail Cruise,56,4.035714,usa,getyourguide,True,True,True,False,False,False,False,False,True,False,False,True,False,False,False,True,True,True,True,True,True
