title,ratings_count,rating_score,region,source,clarity_specifies_location,clarity_specifies_core_activity,clarity_indicates_activity_format,clarity_specifies_key_transport,clarity_indicates_day_trip_origin,value_highlights_access_benefit,value_specifies_guidance,value_specifies_ticket_inclusion,value_mentions_food_drink,value_indicates_target_audience,experience_specifies_group_size,experience_highlights_time_benefit,experience_specifies_duration,experience_uses_hook_keywords,experience_highlights_unique_access,quality_free_of_errors,quality_uses_appropriate_caps,quality_free_of_contact_info,quality_free_of_price_info,quality_concise_and_scannable,processed
Morocco: Tangier Private Tour from Malaga & Tarifa. All Inclusive,145,4.9,europe,viator,True,True,True,False,False,False,False,False,True,False,True,False,False,False,False,True,True,True,True,True,True
Private Stonehenge Tour - London to Southampton,5,5.0,europe,viator,True,True,False,False,False,False,False,False,False,False,True,False,False,False,False,True,True,True,True,True,True
Luxembourg and Dinant Day Trip from Brussels,1284,4.0,europe,viator,True,True,True,False,True,False,False,False,False,False,False,False,False,False,False,True,True,True,True,True,True
Helsinki to Tallinn Guided Tour with return Cruise tickets,369,4.5,europe,viator,True,True,True,True,False,False,True,True,False,False,False,False,False,False,False,True,True,True,True,True,True
The London Eye Entry Ticket,3136,4.1,europe,viator,True,True,False,False,False,False,False,True,False,False,False,False,False,False,False,True,True,True,True,True,True
Express Colosseum Gladiators Gate & Arena Floor Semi-Private Tour,120,5.0,europe,viator,True,True,True,False,False,False,False,False,False,False,True,False,False,False,True,True,True,True,True,True,True
Rome: Borghese Gallery Skip-the-line Ticket with Host,256,3.8,europe,viator,True,True,False,False,False,True,True,True,False,False,False,False,False,False,False,True,True,True,True,True,True
Amsterdam Canal Cruise With Live Guide and Unlimited Drinks,2243,4.7,europe,viator,True,True,True,False,False,False,True,False,True,False,False,False,False,False,False,True,True,True,True,True,True
Chianti Wine Tour from Florence,3362,4.4,europe,viator,True,True,True,False,True,False,False,False,True,False,False,False,False,False,False,True,True,True,True,True,True
#1 Louvre Museum Guided Tour | Satisfaction Guaranteed | 6ppl Max,2894,5.0,europe,viator,True,True,True,False,False,False,True,False,False,False,True,False,False,False,False,True,True,True,True,True,True
London to Stonehenge Shuttle Bus and Independent Day Trip,980,4.0,europe,viator,True,True,True,True,True,False,False,False,False,False,False,False,False,False,False,True,True,True,True,True,True
Hands-on Cooking Class & Farmhouse visit in the Amalfi Coast,729,5.0,europe,viator,True,True,True,False,False,False,False,False,False,True,False,False,False,False,False,True,True,True,True,True,True
Montenegro & Bosnia in 1day: 2 Countries Day Tour from Dubrovnik,199,4.9,europe,viator,True,True,True,False,True,False,False,False,False,False,False,False,True,False,False,True,True,True,True,True,True
Private Tour of La Alhambra de Granada (includes tickets),135,4.8,europe,viator,True,True,False,False,False,False,False,True,False,False,True,False,False,False,False,True,True,True,True,True,True
Snaefellsnes Peninsula Full Day Tour from Reykjavik,774,4.7,europe,viator,True,True,True,False,True,False,False,False,False,False,False,False,True,False,False,True,True,True,True,True,True
Neuschwanstein Castle Tour from Munich,4565,4.6,europe,viator,True,True,True,False,True,False,False,False,False,False,False,False,False,False,False,True,True,True,True,True,True
Alhambra Entry Ticket & Audioguide – Explore at Your Own Pace,33,3.9,europe,viator,True,True,False,False,False,False,False,True,False,False,False,False,False,False,False,True,True,True,True,True,True
Last Supper and Santa Maria delle Grazie Tour,95,4.6,europe,viator,False,True,True,False,False,False,False,False,False,False,False,False,False,False,False,True,True,True,True,True,True
Chamonix and Mont Blanc Day Trip from Geneva,1210,4.2,europe,viator,True,True,True,False,True,False,False,False,False,False,False,False,False,False,False,True,True,True,True,True,True
Paris Early Evening Dinner at Eiffel Tower's Madame Brasserie,141,4.3,europe,viator,True,True,False,False,False,False,False,False,True,False,False,True,False,False,False,True,True,True,True,True,True
Lisbon Private Driver and Customizable Tour,376,4.9,europe,viator,True,True,False,False,False,False,False,False,False,False,True,False,False,False,False,True,True,True,True,True,True
Rome Golf Cart Tour: Highligths of the Eternal City,365,4.9,europe,viator,True,True,False,True,False,False,False,False,False,False,False,False,False,True,False,True,True,True,True,True,True
"Tuscany: Day Trip to Pisa, Siena, San Gimignano, and Chianti",1650,4.7,europe,viator,True,True,True,False,True,False,False,False,False,False,False,False,False,False,False,True,True,True,True,True,True
Charming Gondola Ride on the Grand Canal & Gondola Gallery,824,4.1,europe,viator,True,True,True,False,False,False,False,False,False,False,False,False,False,False,False,True,True,True,True,True,True
Ferrari Lamborghini Pagani Factories and Museums - Tour from Bologna,126,4.8,europe,viator,True,True,True,False,True,False,False,False,False,False,False,False,False,False,False,True,True,True,True,True,True
Versailles Palace & Marie-Antoinette's Estate Private Guided Tour with Lunch,164,4.9,europe,viator,True,True,True,False,False,False,True,False,True,False,True,False,False,False,False,True,True,True,True,True,True
London Small Group Tour of Historical Pubs,7166,5.0,europe,viator,True,True,False,False,False,False,False,False,False,False,True,False,False,False,False,True,True,True,True,True,True
The World Famous Underground Ghost Tour,6979,4.6,europe,viator,False,True,True,False,False,False,False,False,False,False,False,True,False,True,True,True,True,True,True,True,True
Private Tour: Montenegro Day Trip from Dubrovnik,406,4.8,europe,viator,True,False,True,False,True,False,False,False,False,False,True,False,False,False,False,True,True,True,True,True,True
"Golden Circle Tales, Tomato Farm & Kerid! Small Group Adventure",585,4.9,europe,viator,False,True,False,False,False,False,False,False,False,False,True,False,False,True,False,True,True,True,True,True,True
Rome's 12 Best Highlights Full Day Private Tour,195,4.9,europe,viator,True,True,True,False,False,False,False,False,False,False,True,False,True,True,False,True,True,True,True,True,True
The Best Athens Small-Group Shore Excursion from Piraeus Port,8,5.0,europe,viator,True,False,True,False,False,False,False,False,False,False,True,False,False,True,False,True,True,True,True,True,True
Small Group Tour: Colosseum & Roman Forum with Arena Floor Access,475,4.8,europe,viator,True,True,True,False,False,False,False,False,False,False,True,False,False,False,True,True,True,True,True,True,True
Tivoli Full Day Trip from Rome: Hadrian's Villa and Villa D'Este,1624,4.5,europe,viator,True,True,True,False,True,False,False,False,False,False,False,False,True,False,False,True,True,True,True,True,True
"Colosseum, Roman Forum & Palatine Hill Guided Tour",1183,4.3,europe,viator,True,True,True,False,False,False,True,False,False,False,False,False,False,False,False,True,True,True,True,True,True
"Sintra, Pena Palace and Cascais Full Day Tour from Lisbon",593,4.7,europe,viator,True,True,True,False,True,False,False,False,False,False,False,False,True,False,False,True,True,True,True,True,True
"Day Trip of Pompeii, Sorrento and Positano from Naples",286,4.8,europe,viator,True,True,True,False,True,False,False,False,False,False,False,False,False,False,False,False,False,False,False,False,True
White Cliffs of Dover & Historic Canterbury Day Tour from London,256,4.3,europe,viator,True,True,True,False,True,False,False,False,False,False,False,False,False,False,False,True,True,True,True,True,True
Francy's Pasta & Gnocchi on Top of Florence Hills,371,5.0,europe,viator,True,True,False,False,False,False,False,False,False,False,False,False,False,False,False,True,True,True,True,True,True
Private/Mini Group 7-8 Hours Guided Tours from Cruise Port,144,4.8,europe,viator,False,False,True,False,False,False,True,False,False,False,True,False,True,False,False,True,True,True,True,True,True
Champagne and Reims Tasting Day Trip from Paris,267,4.7,europe,viator,True,False,True,False,False,False,False,False,True,False,False,False,False,False,False,True,True,True,True,True,True
Bruges Day Trip from Amsterdam,493,3.9,europe,viator,True,True,True,False,True,False,False,False,False,False,False,False,False,False,False,True,True,True,True,True,True
"PRIVATE & GROUP: Ephesus, House of Mary WITH ENTRY TICKETS+LUNCH",1082,5.0,europe,viator,True,True,False,False,False,False,False,True,True,False,True,False,False,False,False,True,True,True,True,True,True
Rome: Borghese Gallery & Gardens Small Group Guided Tour,2042,4.5,europe,viator,True,True,True,False,False,False,True,False,False,False,True,False,False,False,False,True,True,True,True,True,True
"Rome Pasta and Tiramisu Class: Ravioli, Fettuccine and Fine Wine",603,5.0,europe,viator,True,True,True,False,False,False,False,False,True,False,False,False,False,False,False,True,True,True,True,True,True
Tower of London First Entry with Beefeater Private Meet & Greet,128,4.3,europe,viator,True,True,False,False,False,True,False,False,False,False,True,False,False,False,False,True,True,True,True,True,True
Rome: Borghese Gallery Skip-the-Line Admission & Small Group Tour,1079,4.7,europe,viator,True,True,True,False,False,True,False,True,False,False,True,False,False,False,False,True,True,True,True,True,True
"London: Westminster Abbey, Big Ben & Changing of the Guards Tour",165,4.3,europe,viator,True,True,True,False,False,False,False,False,False,False,False,False,False,False,False,True,True,True,True,True,True
Sightseeing with a Mykonian(Small Group or Private),685,4.9,europe,viator,False,True,False,False,False,False,False,False,False,False,True,False,False,False,False,True,True,True,True,True,True
Private Vatican and Sistine Chapel Grand Tour with Pick-up,113,4.9,europe,viator,True,True,True,False,False,False,False,False,False,False,True,False,False,False,False,True,True,True,True,True,True
"San Gimignano, Siena, Monteriggioni, Chianti Day Trip with Lunch & Wine Tasting",3768,4.4,europe,viator,True,True,True,False,False,False,False,False,True,False,False,False,False,False,False,True,True,True,True,True,True
Northern Lights Minibus Chase,1013,4.8,europe,viator,False,True,False,False,False,False,False,False,False,False,False,False,False,False,False,True,True,True,True,True,True
"San Sebastian Pintxo Food, Wine & Market Foodie Tour(Small Group)",389,5.0,europe,viator,True,True,True,False,False,False,False,False,True,False,True,False,False,False,False,True,True,True,True,True,True
Private Amalfi Coast Day Tour from Sorrento or Naples,864,5.0,europe,viator,True,False,True,False,True,False,False,False,False,False,True,False,False,False,False,True,True,True,True,True,True
Cooking Class in the Heart of Rome: Pizza and Tiramisu Making,788,4.8,europe,viator,True,True,True,False,False,False,False,False,True,False,False,False,False,False,False,True,True,True,True,True,True
"Full-day Fátima, Nazaré, and Óbidos Small-Group Tour from Lisbon",649,4.9,europe,viator,True,True,True,False,True,False,False,False,False,False,True,False,True,False,False,True,True,True,True,True,True
Delphi English Day Trip from Athens with Official guide,2085,4.4,europe,viator,True,False,True,False,True,False,True,False,False,False,False,False,False,False,False,True,True,True,True,True,True
"A day among the most beautiful mountains in the world, the Dolomites and Lake Braies",285,4.9,europe,viator,True,True,False,False,False,False,False,False,False,False,False,False,False,False,False,True,True,True,True,True,True
Whale Watching Tour with Professional Guide from Reykjavik,561,4.3,europe,viator,True,True,True,False,False,False,True,False,False,False,False,False,False,False,False,True,True,True,True,True,True
Dinner in the Sky Athens,352,4.9,europe,viator,True,True,False,False,False,False,False,False,True,False,False,False,False,False,False,True,True,True,True,True,True
"Romantic Road, Rothenburg, and Harburg Day Tour from Munich",1194,4.3,europe,viator,True,True,True,False,True,False,False,False,False,False,False,False,False,True,False,True,True,True,True,True,True
Downton Abbey and Village Small Group Tour from London,322,4.7,europe,viator,True,True,True,False,True,False,False,False,False,False,True,False,False,False,False,True,True,True,True,True,True
City Sightseeing London Hop-on Hop-off Bus Tour,939,3.9,europe,viator,True,True,True,True,False,False,False,False,False,False,False,False,False,False,False,True,True,True,True,True,True
Lysefjord RIB Safari from Stavanger,465,4.9,europe,viator,True,True,True,True,True,False,False,False,False,False,False,False,False,False,False,True,True,True,True,True,True
Sagrada Familia and Gaudi Private Tour with Skip the Line Tickets,838,4.7,europe,viator,True,True,True,False,False,True,False,True,False,False,True,False,False,False,False,True,True,True,True,True,True
Ice Cave Tour in the National Park of Vatnajökull,238,4.2,europe,viator,True,True,True,False,False,False,False,False,False,False,False,False,False,False,False,True,True,True,True,True,True
High-Speed train Rome to Venice: Day trip & Happy Hour,332,4.3,europe,viator,True,True,True,False,True,False,False,False,True,False,False,False,False,False,False,True,True,True,True,True,True
Pantheon Roma Skip-the-Line Tickets,184,4.7,europe,viator,True,True,False,False,False,True,False,False,False,False,False,False,False,False,False,True,True,True,True,True,True
"Milan Highlights: Guided Duomo, Last Supper & City Centre Tour",56,4.5,europe,viator,True,True,True,False,False,False,True,False,False,False,False,False,False,False,False,True,True,True,True,True,True
"South Coast, Diamond Beach and Glacier Lagoon Day Tour",591,4.4,europe,viator,True,True,True,False,False,False,False,False,False,False,False,False,False,False,False,True,True,True,True,True,True
Private D-Day Experience from Bayeux,473,5.0,europe,viator,False,False,True,False,True,False,False,False,False,False,True,False,False,False,False,True,True,True,True,True,True
Flamenco Night at Tablao de Carmen with Tasting Menu or Dinner,677,4.6,europe,viator,False,True,False,False,False,False,False,False,True,False,False,True,False,False,False,True,True,True,True,True,True
"Rome: Private Colosseum, Arena and Underground Tour with Pick-Up",79,4.9,europe,viator,True,True,True,False,False,False,False,False,False,False,True,False,False,False,True,True,True,True,True,True,True
Tower Bridge River Sightseeing Cruise from Westminster,362,4.2,europe,viator,True,True,True,True,True,False,False,False,False,False,False,False,False,False,False,True,True,True,True,True,True
"Rome: Guided Group Tour of Colosseum, Roman Forum & Palatine Hill",2200,4.7,europe,viator,True,True,True,False,False,False,True,False,False,False,True,False,False,False,False,True,True,True,True,True,True
Minivan Northern Lights excursion (8 guests per minivan),290,4.6,europe,viator,False,True,True,False,False,False,False,False,False,False,True,False,False,False,False,True,True,True,True,True,True
Omaha Beach D-Day Experience - Half day group tour from Bayeux,921,4.9,europe,viator,True,True,True,False,True,False,False,False,False,False,True,False,True,False,False,True,True,True,True,True,True
"Dublin: Giant's Causeway, Dark Hedges, Dunluce and Belfast Titanic entrance fee",1546,4.8,europe,viator,True,True,False,False,False,False,False,True,False,False,False,False,False,False,False,True,True,True,True,True,True
"Private Brussels Tour with a Local, Highlights & Hidden Gems, Custom",176,4.9,europe,viator,True,True,False,False,False,False,False,False,False,False,True,False,False,True,False,True,True,True,True,True,True
E-Tuk Tuk Tour in Dubrovnik,971,5.0,europe,viator,True,True,True,True,False,False,False,False,False,False,False,False,False,False,False,True,True,True,True,True,True
Budapest Tuk Tuk City Tour,1000,4.9,europe,viator,True,True,True,True,False,False,False,False,False,False,False,False,False,False,False,True,True,True,True,True,True
Lisbon Sunset Sailing Tour on Luxury Sailing Yacht with 2 Drinks,937,4.9,europe,viator,True,True,True,False,False,False,False,False,True,False,False,True,False,False,False,True,True,True,True,True,True
Fiumicino Airport (FCO) to Rome - Private Arrival Transfer,256,4.9,europe,viator,True,True,False,False,False,False,False,False,False,False,True,False,False,False,False,True,True,True,True,True,True
"Lisbon: Sintra, Regaleira, Pena, Cabo Roca All Tickets Included",182,4.6,europe,viator,True,True,False,False,False,False,False,True,False,False,False,False,False,False,False,True,True,True,True,True,True
Horseback Ride in S.Gimignano with Tuscan Lunch Chianti Tasting,379,4.9,europe,viator,True,True,True,False,False,False,False,False,True,False,False,False,False,False,False,True,True,True,True,True,True
Civitavecchia Private Transfer: Civitavecchia Port to Rome,389,4.6,europe,viator,True,True,False,False,False,False,False,False,False,False,True,False,False,False,False,True,True,True,True,True,True
Chianti Wineries Tour with Tuscan Lunch and San Gimignano,736,4.9,europe,viator,False,True,True,False,False,False,False,False,True,False,False,False,False,False,False,True,True,True,True,True,True
Rhine Falls and Stein am Rhein Half-Day Tour from Zurich,534,4.5,europe,viator,True,True,True,False,True,False,False,False,False,False,False,False,True,False,False,True,True,True,True,True,True
Ice Cave Small-Group Tour from Jökulsárlón,214,4.8,europe,viator,True,True,True,False,True,False,False,False,False,False,True,False,False,False,False,True,True,True,True,True,True
Lunch River Cruise on the Thames with 2-Course Meal,875,4.5,europe,viator,False,True,True,False,False,False,False,False,True,False,False,False,False,False,False,True,True,True,True,True,True
Goðafoss Waterfall from Akureyri Port,123,4.8,europe,viator,True,True,False,False,True,False,False,False,False,False,False,False,False,False,False,True,True,True,True,True,True
Myvatn Nature Baths & Goðafoss Waterfall Akureyri Shore Excursion,34,4.5,europe,viator,True,True,True,False,False,False,False,False,False,False,False,False,False,False,False,True,True,True,True,True,True
Picasso Museum Guided Tour with Skip the Line Ticket,761,4.3,europe,viator,False,True,True,False,False,True,True,True,False,False,False,False,False,False,False,True,True,True,True,True,True
Madrid Tapas & Taverns Small Group Food & History Tour,1560,4.9,europe,viator,True,True,True,False,False,False,False,False,True,False,True,False,False,False,False,True,True,True,True,True,True
Paris Louvre Museum Skip the Line Must-Sees Guided Tour,284,4.5,europe,viator,True,True,True,False,False,True,True,False,False,False,False,False,False,True,False,True,True,True,True,True,True
Milan Super Saver: Skip-the-line Duomo and Rooftop Tour,222,4.3,europe,viator,True,True,True,False,False,True,False,False,False,False,False,False,False,False,False,True,True,True,True,True,True
VIP Kensington Palace Tour & Royal Tea Crown Experience,65,4.5,europe,viator,True,True,True,False,False,False,False,False,False,False,False,False,False,True,False,True,True,True,True,True,True
Paris: Orsay Museum Entry Ticket,119,4.4,europe,viator,True,True,False,False,False,False,False,True,False,False,False,False,False,False,False,True,True,True,True,True,True
Small-Group Brunello di Montalcino Wine-Tasting Trip from Siena,820,4.9,europe,viator,True,False,True,False,True,False,False,False,True,False,True,False,False,False,False,True,True,True,True,True,True
Authentic Pizza Making Class in Naples with Appetizers and Drink,2475,4.8,europe,viator,True,True,True,False,False,False,False,False,True,False,False,False,False,False,False,True,True,True,True,True,True
"Reindeer visit, and Sami Culture Including Lunch from Tromso",437,4.7,europe,viator,True,True,True,False,False,False,False,False,True,False,False,False,False,False,False,True,True,True,True,True,True
Dublin Hop-On Hop-Off Bus Tour with Guide and Little Museum Entry,2849,4.5,europe,viator,True,True,True,True,False,False,True,True,False,False,False,False,False,False,False,True,True,True,True,True,True
Tour Private a Roma In Golf Cart With a Local & GELATO or wine,255,4.9,europe,viator,True,False,True,True,False,False,True,False,True,False,True,False,False,False,False,True,True,True,True,True,True
"Alhambra, Nasrid Palaces, Generalife & Alcazaba Private Tour",157,4.9,europe,viator,True,True,True,False,False,False,False,False,False,False,True,False,False,False,False,True,True,True,True,True,True
Bologna Walking Food Tour With Secret Food Tours,937,4.9,europe,viator,True,True,True,False,False,False,False,False,False,False,False,False,False,True,False,True,True,True,True,True,True
"Private day trip to Siena, San Gimignano, Chianti and Pisa, from Florence",69,5.0,europe,viator,True,False,True,False,True,False,False,False,False,False,True,False,False,False,False,True,True,True,True,True,True
Rome: Exclusive Private Golf Cart Tour,64,4.9,europe,viator,True,True,False,True,False,False,False,False,False,False,True,False,False,False,False,True,True,True,True,True,True
Geiranger Shore Excursion: Mt. Dalsnibba and Eagle Road,545,4.7,europe,viator,True,True,True,False,False,False,False,False,False,False,False,False,False,False,False,True,True,True,True,True,True
London Best of the City Fully Customized Guided Private Tour,123,4.9,europe,viator,True,True,True,False,False,False,True,False,False,False,True,False,False,True,False,True,True,True,True,True,True
Keukenhof & FlowerFarm Tour From Amsterdam Skip-The-Line tickets,15,5.0,europe,viator,True,True,True,False,True,True,False,False,False,False,False,False,False,False,False,True,True,True,True,True,True
Cliffs of Moher & the Burren Tour from Galway,1685,4.8,europe,viator,True,True,True,False,True,False,False,False,False,False,False,False,False,False,False,True,True,True,True,True,True
"Dublin to Kilkenny, Wicklow, Glendalough, Laragh Sheep Dog Trial",6341,4.9,europe,viator,True,False,True,False,False,False,False,False,False,False,False,False,False,False,False,False,False,False,False,False,True
Golden Circle Small-Group Afternoon Tour from Reykjavik,301,4.5,europe,viator,True,True,True,False,True,False,False,False,False,False,True,True,False,False,False,True,True,True,True,True,True
Taormina and Castelmola Tour from Messina,408,4.7,europe,viator,True,True,True,False,True,False,False,False,False,False,False,False,False,False,False,True,True,True,True,True,True
Amalfi Coast Day Trip from Rome by High-Speed Train,84,4.6,europe,viator,True,True,True,True,True,False,False,False,False,False,False,False,False,False,False,True,True,True,True,True,True
"Vatican Museums, Sistine Chapel and Basilica Guided Group Tour",282,4.8,europe,viator,True,True,True,False,False,False,True,False,False,False,True,False,False,False,False,True,True,True,True,True,True
Montserrat Full Day Tour with Farmhouse Lunch and Winery Visit,550,5.0,europe,viator,True,True,True,False,False,False,False,False,True,False,False,False,True,False,False,True,True,True,True,True,True
Paris Private Flexible Duration Guided Tour on a Vintage Sidecar,683,5.0,europe,viator,True,True,True,True,False,False,True,False,False,False,True,False,False,False,False,True,True,True,True,True,True
Alhambra Complete: Ticket Skip-the-Line Nasrid Palace and Generalife with Guide,510,4.2,europe,viator,True,True,True,False,False,True,True,True,False,False,False,False,False,False,False,True,True,True,True,True,True
Discover Porto's Highlights on a 2-Hour Private Electric Tuk Tuk,1539,4.8,europe,viator,True,True,True,True,False,False,False,False,False,False,True,False,True,True,False,True,True,True,True,True,True
Transfer to the Cruise ports from your London accommodation,139,3.9,europe,viator,True,True,True,False,False,False,False,False,False,False,False,False,False,False,False,True,True,True,True,True,True
White Villages and Ronda Day Tour from Seville,1717,4.5,europe,viator,True,True,True,False,True,False,False,False,False,False,False,False,False,False,False,True,True,True,True,True,True
Alhambra with Nazaries Palaces Private Tour,438,5.0,europe,viator,True,True,True,False,False,False,False,False,False,False,True,False,False,False,False,True,True,True,True,True,True
Westminster 3 Hours Walking Tour and Visit of Churchill War Rooms,844,4.8,europe,viator,True,True,True,False,False,False,False,False,False,False,False,False,True,False,False,True,True,True,True,True,True
"Cliffs of Moher, Doolin, Burren and Galway Day Tour from Dublin",2382,4.6,europe,viator,True,True,True,False,True,False,False,False,False,False,False,False,False,False,False,True,True,True,True,True,True
Versailles Small Group Guided Tour with Tranportation from Paris,586,4.6,europe,viator,True,True,True,True,True,False,True,False,False,False,True,False,False,False,False,True,True,True,True,True,True
Cobh (Cork) to Blarney Castle & Kinsale - Shore Excursion,244,4.8,europe,viator,True,True,True,False,False,False,False,False,False,False,False,False,False,False,False,True,True,True,True,True,True
Crystal Blue Ice Cave - Super Jeep From Jökulsárlón Glacier Lagoon,149,4.2,europe,viator,True,True,False,True,True,False,False,False,False,False,False,False,False,True,False,True,True,True,True,True,True
Tuscany Wine tour & San Gimignano from Florence,564,4.8,europe,viator,True,True,True,False,True,False,False,False,True,False,False,False,False,False,False,True,True,True,True,True,True
